company_ID,company_name,company_pic,company_address,company_email,company_field,company_Phone,company_size,training_price,group,training_location,training_date,training_topic,training_field,training_type,order_history,improved_abilities,training_materials_quality,trainer_satisfaction_level,facility,satisfaction_level,continuity,likelihood_of_recommendation
505,Perum Sinaga Wijayanti (Persero) Tbk,Cakrajiya Pradana,"Jalan Cihampelas No. 23
Tangerang, Kalimantan Timur 68421",hwasita@example.net,Real Estat,(0182) 999-8738,Kecil,300000,Retail,"600 Williams Point Apt. 437
Lake Jeremiah, MP 38600",2023-12-05,Professional Capability Development Towards Industry 4.0,Finance,Inhouse Training,2,63,10,9,3,7.333333333333333,yes,55.80272108843537
506,Perum Yuniar Winarsih,Kania Maryadi,"Gang Kendalsari No. 08
Lubuklinggau, RI 55778",mahesanatsir@example.com,"Pertanian, Kehutanan, dan Perikanan",+62 (115) 697-5631,Menengah,500000,Group,"1801 Kristen Field Apt. 953
Jamesview, NV 01141",2023-11-30,Teknik Interview & Investigasi Terselubung Bagi Internal Audit,HR & Training,Public Training,2,37,4,9,9,7.333333333333333,no,50.047619047619044
507,PD Rahimah Megantara,Septi Novitasari,"Jl. Rawamangun No. 2
Pangkalpinang, Sulawesi Barat 15579",cakrajiyamangunsong@example.org,Lainnya,(008) 843 3824,Besar,900000,Group,"48221 Courtney Center Apt. 049
East Keith, WY 42822",2023-12-24,Professional Telesales & Telemarketing,HR & Training,Inhouse Training,1,25,4,7,10,7.0,no,45.0
508,Perum Kusmawati Utama,"Zulaikha Damanik, S.Gz","Gang Kiaracondong No. 86
Bekasi, RI 53302",haryantoteguh@example.org,Pengangkutan dan Pergudangan,0862732481,Besar,800000,Retail,"3301 Conway Fort Suite 296
South Amberhaven, MS 40661",2023-12-06,Modern Project Management: Combining Scrum & Sprint,Leadership & Managerial,Inhouse Training,8,52,10,6,10,8.666666666666666,yes,70.42176870748298
509,PD Rajata Nasyidah,Gangsar Setiawan,"Jalan Gegerkalong Hilir No. 388
Serang, GO 52230",jpurwanti@example.com,Perdagangan Besar Dan Eceran; Reparasi Dan Perawatan Mobil Dan Sepeda Motor,+62-818-721-2925,Besar,600000,Group,"5805 Henry Crescent Apt. 526
North Heather, AK 18942",2024-01-04,Financial Credit: Rating & Scoring,Office & Administration,Inhouse Training,4,88,7,1,3,3.6666666666666665,no,39.238095238095234
510,UD Widodo Tbk,drg. Gantar Hartati,"Gg. Kutai No. 11
Prabumulih, Kepulauan Bangka Belitung 36039",asiregar@example.com,"Kesenian, Hiburan Dan Rekreasi",082 224 1616,Besar,400000,Retail,"64399 Woods Throughway Suite 279
West Jeffrey, MH 09277",2023-11-27,"How to Effectively Manage, Coach & Mentor Subordinate Who Work From Home",Credit & Collection,Online Training,2,89,5,4,10,6.333333333333333,no,51.76190476190476
511,PT Hidayanto,drg. Sadina Hastuti,"Gang R.E Martadinata No. 822
Palembang, MA 28718",kenes15@example.com,"Kesenian, Hiburan Dan Rekreasi",+62 (504) 303-5799,Menengah,300000,Group,"90639 Glass Turnpike Suite 750
Mirandahaven, OR 12397",2023-12-21,Industry Forecasting & Bussiness Valuation Workshop: Start Up & Conventional Business,Office & Administration,Public Training,8,39,1,7,1,3.0,no,34.142857142857146
512,PT Maulana Kusumo (Persero) Tbk,Nova Wibowo,"Gg. Kutisari Selatan No. 3
Kendari, JB 13576",mrajata@example.net,PendidikanAktivitas Kesehatan Manusia Dan Aktivitas Sosial,+62 (40) 220 3051,Besar,900000,Group,"7414 Susan Passage Apt. 982
New Wendy, CO 64562",2023-12-05,Life Coach: Achieving Work-Life Balance,Credit & Collection,Public Training,5,32,1,8,9,6.0,no,46.0
513,PD Marpaung Tbk,Uli Hutagalung,"Gg. Kiaracondong No. 2
Kota Administrasi Jakarta Utara, SB 71064",setya98@example.com,"Aktivitas Profesional, Ilmiah Dan Teknis",+62 (33) 001 1723,Besar,200000,Retail,"69551 Laura Mountains Apt. 994
Wilsontown, CT 47838",2023-12-03,Succession Planning & Management,Leadership & Managerial,Inhouse Training,9,73,3,1,4,2.6666666666666665,no,38.52380952380952
514,PT Latupono Wasita (Persero) Tbk,"Tgk. Ana Wahyuni, M.TI.","Jl. W.R. Supratman No. 86
Tegal, Nusa Tenggara Timur 11288",karyahalimah@example.net,Real Estat,+62 (038) 459 7979,Kecil,800000,Retail,"4843 Herrera Landing
Danielton, LA 58607",2023-12-08,How to detect & prevent application fraud in Digital Era for banking & fintech,HR & Training,Public Training,5,73,7,7,1,5.0,no,46.142857142857146
515,CV Jailani,Eli Budiyanto,"Gg. Jakarta No. 18
Banjarmasin, BA 72919",flaksmiwati@example.org,Aktivitas Jasa Lainnya,(0066) 049 9246,Kecil,800000,Group,"PSC 1806, Box 0063
APO AE 35424",2023-12-14,Teknik Penagihan Era Covid 19 & PJOK 11 (3/2020),Sales & Marketing,Public Training,3,43,8,5,7,6.666666666666667,yes,50.564625850340136
516,UD Permata,Ajimin Hutasoit,"Gang Cikutra Timur No. 400
Meulaboh, GO 19547",ella30@example.net,Aktivitas Jasa Lainnya,+62 (955) 228 1382,Menengah,200000,Group,"5644 Mackenzie Inlet
North Toddborough, NV 30895",2023-11-21,Create A Simple Integrating Payroll System For Salary Efficiently And Effectively,Office & Administration,Inhouse Training,7,92,7,3,10,6.666666666666667,no,61.23809523809524
517,UD Purnawati,Jatmiko Nababan,"Gang Indragiri No. 3
Sibolga, DKI Jakarta 46446",namagatami@example.org,"Aktivitas Profesional, Ilmiah Dan Teknis",+62 (0930) 875 6512,Menengah,500000,Group,"87290 Joshua Harbor
Elizabethhaven, CT 98009",2024-01-01,Sales Performance Improvement,Credit & Collection,Online Training,4,75,7,2,3,4.0,no,39.285714285714285
518,CV Hidayanto,"Dr. Kurnia Astuti, S.E.I","Jl. Abdul Muis No. 69
Parepare, Maluku 56768",eriksuryono@example.org,Pengangkutan dan Pergudangan,+62-078-555-5248,Besar,400000,Group,"2395 Hooper Parks Suite 022
Port Shane, PR 65821",2023-12-22,Mengelola NPL dengan Early Warning System (EWS),HR & Training,Inhouse Training,9,31,9,10,6,8.333333333333334,no,64.90476190476191
519,PT Wulandari Simanjuntak,"Balijan Prabowo, S.Pt","Gg. Kebonjati No. 78
Sibolga, SB 90029",vanggriawan@example.com,PendidikanAktivitas Kesehatan Manusia Dan Aktivitas Sosial,+62 (56) 702-5448,Menengah,500000,Retail,"48391 Allen Junction Apt. 614
South Timothy, IA 56724",2023-12-12,Teknik Penjualan yang Efektif di Era Covid-19 & WFH,Sales & Marketing,Online Training,8,31,3,8,8,6.333333333333333,no,52.047619047619044
520,Perum Samosir,"Hafshah Hutagalung, S.Pt","Gang Cikutra Barat No. 322
Ternate, JI 88535",saptonoopung@example.com,"Treatment Air, Treatment Air Limbah, Treatment dan Pemulihan Material Sampah, dan Aktivitas Remediasi",+62 (474) 475-3472,Kecil,100000,Retail,"00321 Johnson Flat Apt. 923
West Heather, WV 45561",2023-11-11,Excel & PowerPoint for Powerful Business Application,Credit & Collection,Online Training,2,77,4,3,4,3.6666666666666665,no,34.80952380952381
521,UD Anggraini (Persero) Tbk,Ganda Maulana,"Jl. Lembong No. 006
Parepare, Riau 82984",rahminugroho@example.net,"Aktivitas Penyewaan dan Sewa Guna Usaha Tanpa Hak Opsi, Ketenagakerjaan, Agen Perjalanan dan Penunjang Usaha Lainnya",+62 (227) 862 5698,Menengah,800000,Group,"Unit 4312 Box 9380
DPO AE 06416",2023-12-23,Audit Treasury Management For Banking,HR & Training,Public Training,1,33,3,3,8,4.666666666666667,no,32.80952380952381
522,PD Sitorus Suartini Tbk,KH. Damar Prasetya,"Jl. Rajiman No. 55
Magelang, JT 91484",cpurwanti@example.com,Informasi Dan KomunikasiAktivitas Keuangan dan Asuransi,(0265) 002-5987,Besar,600000,Retail,"565 Ford Centers Suite 319
Mcgeeside, GU 18255",2023-12-11,"Sekuritisasi Asset: Pengembangan Produk, Analisa Resiko, Aspek Legal, Perpajakan dan Strukturisasinya",HR & Training,Public Training,7,80,8,3,3,4.666666666666667,no,48.095238095238095
523,Perum Pradana Lailasari Tbk,Sadina Sihombing,"Gg. Rajawali Barat No. 41
Tegal, Sulawesi Tengah 52334",galih58@example.org,Perdagangan Besar Dan Eceran; Reparasi Dan Perawatan Mobil Dan Sepeda Motor,+62 (0145) 254-8721,Menengah,100000,Group,"5895 Eduardo Flats
Hansenland, MD 55800",2023-12-10,HR consulting skills for HR Professional: Core skills to ensure  excellent strategies to implementation,Finance,Online Training,6,80,7,2,8,5.666666666666667,no,52.38095238095239
524,Perum Yuniar,Silvia Purnawati,"Jalan Stasiun Wonokromo No. 03
Kota Administrasi Jakarta Selatan, Sumatera Barat 22024",widodosalimah@example.org,Pertambangan dan Penggalian,+62-89-141-7116,Menengah,800000,Group,"07651 Joseph Groves
Timothyhaven, CO 18257",2023-12-05,Keterampilan Komunikasi Dalam Rapat Dan Diskusi,Leadership & Managerial,Inhouse Training,6,47,6,7,1,4.666666666666667,no,41.95238095238095
525,Perum Samosir Pratama,"Tgk. Victoria Dongoran, S.Pt","Jl. Joyoboyo No. 44
Tanjungpinang, Kalimantan Selatan 53051",plestari@example.org,"Treatment Air, Treatment Air Limbah, Treatment dan Pemulihan Material Sampah, dan Aktivitas Remediasi",+62-008-878-2059,Menengah,900000,Retail,"63519 Jasmine Crossing
Susanton, SC 96516",2023-11-09,"Document Management 4.0 (Advance E-Filing preparing for BlockChain, IOT & Artificial Intellligence Era) comply to UU ITE",Leadership & Managerial,Public Training,3,80,4,9,1,4.666666666666667,no,42.38095238095237
526,Perum Usada (Persero) Tbk,"T. Mujur Saefullah, M.Ak","Jl. Rajawali Timur No. 185
Padangpanjang, KU 31202",wardi56@example.net,Industri Pengelahan,(046) 000 1586,Kecil,800000,Retail,"4078 Jason Motorway Suite 874
Port Jillian, MH 79400",2023-11-24,Industry Forecasting & Bussiness Valuation Workshop: Start Up & Conventional Business,Office & Administration,Inhouse Training,8,79,1,6,10,5.666666666666667,no,55.095238095238095
527,PD Hidayat (Persero) Tbk,Oliva Suryono,"Gg. Tebet Barat Dalam No. 69
Metro, Sumatera Selatan 95687",januarzalindra@example.org,"Aktivitas Profesional, Ilmiah Dan Teknis",+62 (042) 856 4440,Menengah,600000,Group,"31522 Watson Trail
South Matthewville, AS 95508",2023-11-09,People (HR) Analytics: For HR & Non HR Professional,Finance,Public Training,4,97,1,9,10,6.666666666666667,no,57.66666666666667
528,PT Melani Tbk,Saka Palastri,"Jl. K.H. Wahid Hasyim No. 87
Depok, NB 13684",ajimin81@example.com,Perdagangan Besar Dan Eceran; Reparasi Dan Perawatan Mobil Dan Sepeda Motor,+62 (730) 322-9992,Kecil,200000,Group,"9366 Chandler Villages Apt. 708
Grayville, MO 25978",2023-12-07,"Manajemen Resiko APU & PPT bagi Staff Perbankan, Multifinance, Sekuritas dan Asuransi",HR & Training,Public Training,8,68,6,2,2,3.3333333333333335,no,40.1904761904762
529,PD Saefullah Tbk,"Ir. Hani Dabukke, S.E.","Jalan Bangka Raya No. 7
Tangerang, PA 47226",hartatiwarji@example.com,"Pengadaan Listrik, Gas, Uap/Air Panas Dan Udara Dingin",+62-919-625-2427,Kecil,500000,Retail,"491 Shaun Squares
Alvarezfort, AS 56225",2023-12-02,Managing People & Talent In Generation Y & Z,Finance,Public Training,6,24,2,2,10,4.666666666666667,no,38.666666666666664
530,UD Fujiati Iswahyudi (Persero) Tbk,"Janet Kusumo, S.H.","Jl. Jayawijaya No. 994
Pontianak, Jawa Tengah 42219",rusamah@example.net,PendidikanAktivitas Kesehatan Manusia Dan Aktivitas Sosial,+62 (042) 119-1731,Kecil,700000,Group,"55617 Kline Underpass
North Sara, PW 33482",2023-12-24,Build A Great And Strong Corporate Culture,Finance,Public Training,2,70,4,5,8,5.666666666666667,no,45.238095238095234
531,PD Megantara,Heryanto Lailasari,"Jl. Pacuan Kuda No. 781
Bogor, Jambi 71331",putri38@example.com,"Treatment Air, Treatment Air Limbah, Treatment dan Pemulihan Material Sampah, dan Aktivitas Remediasi",(030) 742-1124,Besar,600000,Retail,"1889 Michael Pine Apt. 996
South Elizabethbury, HI 25921",2024-01-06,Optimalisasi Social Media Branding Menggunakan Storytelling,Sales & Marketing,Online Training,5,48,10,3,10,7.666666666666667,yes,59.85034013605442
532,UD Nasyidah Saptono,Lega Suryono,"Jalan Merdeka No. 5
Medan, Gorontalo 66722",amihartati@example.com,Industri Pengelahan,+62 (506) 418-8603,Menengah,100000,Retail,"78999 Amber Ports
New Wyattland, UT 83343",2023-11-12,Enterprise Solution Selling,Sales & Marketing,Inhouse Training,6,28,5,4,10,6.333333333333333,yes,50.80272108843537
533,CV Puspasari Purnawati Tbk,"Ghaliyati Kuswoyo, S.Sos","Gg. Waringin No. 3
Meulaboh, SU 61374",vinsenusamah@example.com,"Aktivitas Profesional, Ilmiah Dan Teknis",(029) 008-9185,Besar,100000,Group,"0632 Jill Pike Apt. 464
Lake Jacob, DE 78373",2023-12-22,Warehouse Administration for Better Efficiency & Productivity,Leadership & Managerial,Inhouse Training,7,97,4,8,1,4.333333333333333,no,48.61904761904761
534,UD Suwarno (Persero) Tbk,Karsa Marpaung,"Jalan Bangka Raya No. 044
Pontianak, Lampung 37289",jayawaskita@example.net,Informasi Dan KomunikasiAktivitas Keuangan dan Asuransi,(0009) 261-0040,Kecil,100000,Group,"9593 Randy Turnpike
Port Keith, DC 79070",2024-01-01,Project Management & Assertive User Handling,Sales & Marketing,Online Training,1,33,3,8,5,5.333333333333333,no,36.61904761904763
535,CV Waskita Hariyah (Persero) Tbk,Empluk Narpati,"Jl. Otto Iskandardinata No. 7
Jayapura, Kalimantan Utara 77121",siregarjasmani@example.net,"Pengadaan Listrik, Gas, Uap/Air Panas Dan Udara Dingin",+62 (0428) 215 4123,Besar,800000,Retail,"042 Reginald Lane
Browntown, MN 43389",2023-11-26,Manajemen Filing & Tata Kelola Kantor,Leadership & Managerial,Public Training,5,81,10,1,7,6.0,no,53.0
536,Perum Hutagalung (Persero) Tbk,"Rachel Iswahyudi, S.Ked","Jl. Cempaka No. 3
Semarang, SU 89236",cmandasari@example.com,Kontruksi,(0796) 437 5175,Kecil,1000000,Group,"87839 Mary Lodge
Anitashire, NC 01269",2023-12-07,Mengubah Bawahan Bermasalah & Berkonflik Menjadi Produktif & Suportif,Leadership & Managerial,Online Training,3,77,2,1,6,3.0,no,32.42857142857143
537,CV Ardianto,Puti Rahayu,"Jl. Jamika No. 579
Tidore Kepulauan, Jawa Barat 99514",wijayajessica@example.net,Lainnya,085 185 7451,Kecil,600000,Retail,"USCGC Barber
FPO AP 76784",2023-12-31,Sales Forecasting,HR & Training,Public Training,5,79,3,2,7,4.0,no,41.285714285714285
538,UD Mandasari Fujiati,Michelle Dabukke,"Gg. Ciumbuleuit No. 096
Tidore Kepulauan, Gorontalo 19600",nainggolancici@example.com,Pertambangan dan Penggalian,+62 (77) 708 5122,Menengah,400000,Group,"59962 Jacob Ville Suite 863
Norrisburgh, AZ 41337",2023-11-26,"Business Acumen: Think, Sense & Act like CEO",Credit & Collection,Inhouse Training,5,26,5,9,1,5.0,no,39.42857142857143
539,CV Mangunsong,Salwa Budiyanto,"Gang Ciumbuleuit No. 2
Binjai, DI Yogyakarta 20463",jessica52@example.com,Lainnya,+62-051-824-0232,Kecil,200000,Group,"3957 Brown Oval Apt. 195
South Steven, FM 45430",2023-12-23,Hak dan Kewajiban Pegawai di Era New Normal: Adaptasi Kebijakan Baru pasca Covid 19,Sales & Marketing,Online Training,2,92,6,6,3,5.0,no,44.57142857142857
540,PD Firmansyah Yulianti,Hesti Prayoga,"Gang Jayawijaya No. 515
Padang Sidempuan, KB 74945",niyagapangestu@example.org,Perdagangan Besar Dan Eceran; Reparasi Dan Perawatan Mobil Dan Sepeda Motor,(079) 620-5576,Menengah,100000,Retail,"144 Jason Place
Lake Lisahaven, VT 08712",2023-12-23,Collection Recovery Section Head Development Program,HR & Training,Inhouse Training,7,77,8,2,1,3.6666666666666665,no,41.95238095238095
541,Perum Hartati Tbk,Rika Nasyiah,"Gang PHH. Mustofa No. 79
Sawahlunto, Riau 74585",owacana@example.net,Kontruksi,+62 (0371) 774 8949,Besar,800000,Retail,"349 Anna Burg
Port Amy, SD 13207",2023-12-23,Advanced Credit Analysis for Corporate & Commercial,Finance,Public Training,8,58,3,1,9,4.333333333333333,no,44.476190476190474
542,Perum Usada Tbk,"KH. Himawan Permadi, S.Pt","Jl. Peta No. 57
Banjarbaru, SG 86151",suartiniqueen@example.net,Aktivitas Badan Internasional Dan Badan Ekstra Internasional,+62 (08) 726-9066,Besar,300000,Retail,"50046 Hull Ridges
Tracyburgh, WI 45655",2023-12-20,Collection For Corporate & Commercial Credit,HR & Training,Public Training,3,30,9,5,7,7.0,yes,50.61224489795918
543,PT Nashiruddin,Cut Gawati Novitasari,"Jalan Stasiun Wonokromo No. 723
Cirebon, Sulawesi Selatan 03538",kuntharamaryati@example.org,Penyediaan Akomodasi Dan Penyediaan Makan Minum,+62-550-822-3340,Kecil,1000000,Group,"328 Dawn Island Suite 330
East Kimberlytown, WI 07540",2023-12-23,Memaksimalkan Digital Marketing Untuk Bisnis,Sales & Marketing,Online Training,9,55,3,8,7,6.0,no,55.0
544,Perum Utami,Jinawi Sihombing,"Jl. Cihampelas No. 176
Palangkaraya, Nusa Tenggara Barat 09476",amulyani@example.com,Penyediaan Akomodasi Dan Penyediaan Makan Minum,(0034) 048-8672,Kecil,900000,Group,"899 Julie Station
Kristinstad, WY 23502",2023-11-23,Microsoft Excel VBA (Macros) Complete Beginner,Leadership & Managerial,Inhouse Training,6,61,10,6,7,7.666666666666667,yes,63.13605442176871
545,PT Nainggolan,Zaenab Lazuardi,"Jalan KH Amin Jasuta No. 57
Bogor, KR 60583",nainggolansalimah@example.com,Kontruksi,+62 (0951) 764-8482,Kecil,800000,Group,"0098 James Mill Suite 144
New Pennystad, IL 42724",2024-01-04,Managing People & Talent In Generation Y & Z,Finance,Inhouse Training,9,23,9,1,5,5.0,no,44.714285714285715
546,UD Handayani,"Asmadi Pradana, M.Ak","Jl. Ciwastra No. 2
Banjarmasin, Gorontalo 71668",mangunsongtasnim@example.com,Real Estat,0857249774,Besar,600000,Group,"51805 Lewis Glen
Port Cynthiafort, ND 07746",2023-12-05,Professional Debt Collection Skills,HR & Training,Online Training,6,95,6,9,10,8.333333333333334,no,69.76190476190477
547,UD Nashiruddin,"Agus Firmansyah, M.TI.","Gg. Waringin No. 807
Magelang, SU 80255",budimandamar@example.org,Penyediaan Akomodasi Dan Penyediaan Makan Minum,+62 (625) 503-1367,Menengah,200000,Retail,"216 Scott Burg
Elizabethton, NM 70228",2023-11-24,How To Conduct TNA Creating Training Material & Measuring Training Effectivity,Office & Administration,Inhouse Training,7,31,3,9,1,4.333333333333333,no,39.19047619047619
548,PD Widiastuti,Keisha Hariyah,"Gg. Asia Afrika No. 8
Bekasi, Jawa Timur 86595",nardipradipta@example.net,Aktivitas Badan Internasional Dan Badan Ekstra Internasional,0851790520,Menengah,100000,Retail,"5655 Hubbard Cliff
Jacobhaven, NE 44196",2023-11-10,Emotional Communication Skill & Team Spirit For Luxury Experience,Finance,Public Training,9,88,3,5,7,5.0,no,54.0
549,CV Melani,"Gilda Aryani, S.T.","Gg. Laswi No. 140
Dumai, JI 66029",zjailani@example.com,"Kesenian, Hiburan Dan Rekreasi",(0221) 605 3703,Besar,500000,Group,"9457 Robert Divide Suite 284
Khanburgh, ND 48916",2023-12-22,Shopfloor Leadership & Management : Leading By Genba Keizen,Leadership & Managerial,Public Training,2,40,1,4,6,3.6666666666666665,no,29.523809523809522
550,PT Astuti Tbk,"drg. Halima Maheswara, S.IP","Jl. Cihampelas No. 8
Jayapura, DKI Jakarta 63497",rsimbolon@example.com,Kontruksi,(023) 676 5354,Kecil,300000,Group,"97207 Garcia Square
Rachelhaven, TX 23338",2023-11-24,Simple Methode of Corporate Tax Calculation PPN-PPH,Office & Administration,Online Training,4,37,7,8,6,7.0,yes,53.04081632653061
551,PD Sihombing,Ira Kurniawan,"Jalan M.T Haryono No. 805
Ternate, Sulawesi Utara 57378",prabu21@example.net,Aktivitas Badan Internasional Dan Badan Ekstra Internasional,(0882) 358-4058,Menengah,200000,Group,"5104 Jones Oval Apt. 068
North Shane, MO 72402",2023-12-10,"Business Acumen: Think, Sense & Act like CEO",Finance,Public Training,6,83,8,9,4,7.0,yes,62.46938775510204
552,CV Winarsih Susanti (Persero) Tbk,Nyana Kusmawati,"Gang Cempaka No. 6
Tarakan, Nusa Tenggara Timur 96270",pardidamanik@example.com,Informasi Dan KomunikasiAktivitas Keuangan dan Asuransi,+62 (992) 546 2612,Kecil,600000,Group,"5002 Tammy Run
Angelaport, AK 97800",2023-11-24,Sales Forecasting,HR & Training,Public Training,1,90,3,7,2,4.0,no,37.142857142857146
553,Perum Wastuti (Persero) Tbk,Septi Laksmiwati,"Jl. Pasir Koja No. 8
Salatiga, SU 66654",eka16@example.net,Lainnya,0811992828,Besar,500000,Group,"524 Alicia Mountain Apt. 493
Clarkbury, ID 43941",2024-01-06,Mental & Workload Anaylisis in New Normal Era,Office & Administration,Public Training,5,29,2,8,10,6.666666666666667,yes,51.421768707483
554,CV Kuswoyo (Persero) Tbk,Cornelia Mansur,"Gg. Rumah Sakit No. 3
Pasuruan, SN 74136",taswir43@example.net,"Kesenian, Hiburan Dan Rekreasi",+62-071-797-0932,Kecil,900000,Group,"78434 Lindsay Junctions
Hillton, PW 32009",2024-01-05,Improving Sales Team Performance,Credit & Collection,Public Training,8,87,4,5,7,5.333333333333333,no,54.33333333333333
555,Perum Jailani Tbk,Gamblang Putra,"Jl. Ir. H. Djuanda No. 534
Bogor, Aceh 49769",crajata@example.org,"Pengadaan Listrik, Gas, Uap/Air Panas Dan Udara Dingin",+62 (0274) 865 6757,Besar,500000,Retail,"918 Logan Knolls
New Daniel, NM 07839",2023-11-24,"Business Acumen: Think, Sense & Act like CEO",Credit & Collection,Public Training,1,55,8,1,6,5.0,no,37.857142857142854
556,UD Haryanti Wijayanti,Kani Namaga,"Jalan M.T Haryono No. 28
Bandar Lampung, MA 64904",asirwadahidayanto@example.com,Aktivitas Rumah Tangga Sebagai Pemberi Kerja; Aktivitas Yang Menghasilkan Barang Dan Jasa Oleh Rumah Tangga yang Digunakan untuk Memenuhi Kebutuhan Sendiri,0899787949,Menengah,700000,Group,"46273 Joyce Trail Apt. 625
Port Leslie, DE 34371",2023-11-27,"Strategi Perusahaan Dalam Menghadapi COVID 19: Financial, Operational, HR-IR, Business Continuity Plan",Credit & Collection,Online Training,2,59,7,4,5,5.333333333333333,no,41.761904761904766
557,CV Nasyidah (Persero) Tbk,Ulva Sudiati,"Jl. Waringin No. 4
Kediri, JK 27867",lwibisono@example.com,Pertambangan dan Penggalian,+62-025-957-5389,Kecil,100000,Group,"24720 Victor Hills
West Logan, NH 80442",2023-12-01,"How To Recruit, Interview, Select & Place The Right Employee",Finance,Online Training,3,40,10,8,3,7.0,no,50.0
558,PT Halimah,Lantar Simbolon,"Gg. Kapten Muslihat No. 40
Payakumbuh, Maluku 80604",mwaskita@example.org,Pertambangan dan Penggalian,+62 (15) 093 6604,Menengah,500000,Group,"9193 Ho Path Apt. 364
South Timothystad, LA 42312",2023-11-09,Managing People & Talent In Generation Y & Z,Finance,Public Training,4,89,5,9,9,7.666666666666667,yes,64.27891156462586
559,UD Budiman,Cici Saragih,"Jl. Wonoayu No. 3
Surabaya, SB 21486",kamila12@example.com,Aktivitas Rumah Tangga Sebagai Pemberi Kerja; Aktivitas Yang Menghasilkan Barang Dan Jasa Oleh Rumah Tangga yang Digunakan untuk Memenuhi Kebutuhan Sendiri,+62-25-539-3650,Kecil,800000,Retail,"134 Allen Heights
New Michael, PR 45427",2023-12-28,Manajemen Filing & Tata Kelola Kantor,Leadership & Managerial,Public Training,9,89,7,5,1,4.333333333333333,no,50.33333333333333
560,PD Dabukke (Persero) Tbk,Ir. Jaeman Permata,"Jalan Sadang Serang No. 611
Bukittinggi, Kalimantan Tengah 94100",sihombingjaya@example.org,Lainnya,+62 (0366) 440 7740,Menengah,700000,Retail,"4580 Brianna Turnpike Suite 021
Burchstad, DE 75673",2023-11-21,Advance RM training: RM sebagai Business Coach kepada Debiturnya. Phase 2: Business Coach Membuat Bisnis Debitur menjadi Level Korporat,Sales & Marketing,Online Training,4,99,5,8,6,6.333333333333333,no,56.047619047619044
561,UD Siregar,Ozy Marbun,"Jl. M.H Thamrin No. 8
Kota Administrasi Jakarta Utara, Nusa Tenggara Timur 05634",widiastutikarja@example.net,Real Estat,+62 (17) 565-4554,Kecil,400000,Retail,"9787 Anderson Neck
Erinmouth, SC 67273",2023-12-06,Teknik Penyelesaian Kredit & Pemasaran AYDA Yang Efektif,Finance,Inhouse Training,2,39,1,3,9,4.333333333333333,no,33.19047619047619
562,PT Nasyiah Tbk,Aisyah Tarihoran,"Gang Cikutra Barat No. 368
Kotamobagu, Sumatera Barat 06424",plestari@example.com,Penyediaan Akomodasi Dan Penyediaan Makan Minum,(0002) 481-8590,Kecil,700000,Group,"38615 Gregory Dam Suite 626
Port Cheryl, IN 41946",2023-11-28,"Business Acumen: Think, Sense & Act like CEO",Finance,Online Training,7,36,6,10,10,8.666666666666666,yes,66.70748299319727
563,PT Wahyuni Hidayanto Tbk,Betania Waskita,"Jalan Rawamangun No. 37
Kota Administrasi Jakarta Utara, RI 25334",yuliartiprabawa@example.com,"Pengadaan Listrik, Gas, Uap/Air Panas Dan Udara Dingin",+62 (89) 915 6966,Besar,100000,Group,"3695 King Freeway
Andreland, AS 45809",2024-01-01,Experiential Marketing Strategy & Tactics,Sales & Marketing,Public Training,9,25,8,4,5,5.666666666666667,no,48.80952380952381
564,UD Hartati Nurdiyanti,Qori Novitasari,"Gg. Rajawali Timur No. 478
Sorong, Maluku 08048",ika02@example.org,PendidikanAktivitas Kesehatan Manusia Dan Aktivitas Sosial,(0384) 967-8046,Besar,500000,Retail,"1343 Connie Mall
Brooksmouth, KS 41367",2023-11-10,Restrukturisasi Kredit for SME Lending (Mortgage based),HR & Training,Inhouse Training,2,57,10,3,5,6.0,yes,47.326530612244895
565,PD Yuliarti,Oskar Thamrin,"Gg. Sadang Serang No. 07
Tegal, Kepulauan Riau 83830",cmaryati@example.net,Pengangkutan dan Pergudangan,+62 (60) 272-3061,Kecil,500000,Group,"405 Butler Lock
Jacksonbury, NM 10548",2023-12-19,"Manajemen Emosi, Temperamen, Dan Kontrol Diri Untuk Service Excellent",Leadership & Managerial,Online Training,1,51,10,2,8,6.666666666666667,no,46.80952380952381
566,Perum Hidayat Mulyani (Persero) Tbk,Dt. Candrakanta Siregar,"Gang Ahmad Dahlan No. 29
Palembang, Nusa Tenggara Barat 47497",cengkal80@example.com,"Administrasi Pemerintahan, Pertahanan Dan Jaminan Sosial Wajib",+62-12-613-2230,Besar,800000,Retail,"43987 Rose Passage Suite 783
Lynnbury, NM 10769",2023-11-19,Effective Communication & Interpersonal Skills,Credit & Collection,Inhouse Training,7,43,5,8,3,5.333333333333333,no,46.61904761904761
567,PD Astuti (Persero) Tbk,"Cut Hesti Winarsih, S.E.","Gang Kutai No. 6
Kediri, MU 95889",zulkarnainyono@example.org,Aktivitas Badan Internasional Dan Badan Ekstra Internasional,+62 (54) 040 8545,Menengah,900000,Group,"4975 Whitaker Walks
Caldwellborough, OK 01985",2023-12-18,Graphonomy & Graphology Pencegahan Pemalsuan Tanda Tangan & Penipuan Dokumen di Era New Normal,HR & Training,Online Training,5,36,7,7,8,7.333333333333333,no,54.19047619047619
568,PT Simbolon Handayani Tbk,Dt. Marsito Suryono,"Gang PHH. Mustofa No. 4
Subulussalam, SB 78045",dabukkewage@example.com,"Administrasi Pemerintahan, Pertahanan Dan Jaminan Sosial Wajib",+62 (721) 631 5482,Menengah,800000,Retail,"653 Williams Creek Apt. 493
Longton, TX 69203",2023-12-20,Applied Debt Collection Strategy & Tactics,HR & Training,Inhouse Training,1,66,8,9,3,6.666666666666667,no,48.952380952380956
