company_ID,company_name,company_pic,company_address,company_email,company_field,company_Phone,company_size,training_price,group,training_location,training_date,training_topic,training_field,training_type,order_history,improved_abilities,training_materials_quality,trainer_satisfaction_level,facility,satisfaction_level,continuity,likelihood_of_recommendation
695,PT Utami,"Dr. Slamet Uyainah, S.Pt","Jalan Astana Anyar No. 521
Banjarmasin, DI Yogyakarta 88044",ajimat80@example.net,Real Estat,+62 (029) 538 3797,Besar,600000,Group,"959 Daniel Parkway Suite 041
Port Margaret, CT 88542",2023-11-24,Warehouse Administration for Better Efficiency & Productivity,Leadership & Managerial,Online Training,7,75,8,5,5,6.0,yes,57.04081632653061
696,UD Wahyudin Jailani,"Reza Kusmawati, M.M.","Jalan Sadang Serang No. 6
Denpasar, Sumatera Selatan 62311",entengsihotang@example.net,"Kesenian, Hiburan Dan Rekreasi",(0904) 478-2165,Menengah,400000,Retail,"42738 Ronald Parkway
Stewarttown, KS 62984",2023-11-23,Teknik Penjualan Aset Kredit Bermasalah,Sales & Marketing,Public Training,7,67,8,5,2,5.0,no,48.142857142857146
697,PD Mandasari (Persero) Tbk,Queen Setiawan,"Jl. Siliwangi No. 1
Kota Administrasi Jakarta Utara, Lampung 46675",oskar38@example.net,Aktivitas Rumah Tangga Sebagai Pemberi Kerja; Aktivitas Yang Menghasilkan Barang Dan Jasa Oleh Rumah Tangga yang Digunakan untuk Memenuhi Kebutuhan Sendiri,086 085 3692,Menengah,1000000,Group,"359 Ryan Route Apt. 008
New Andrewberg, DC 11585",2023-12-16,Soft Skills for Credit Analyst & Surveyor,Sales & Marketing,Inhouse Training,3,65,2,1,5,2.6666666666666665,no,28.809523809523807
698,UD Mansur Uyainah,Among Anggriawan,"Gg. Rajawali Timur No. 3
Tangerang, Kalimantan Utara 16980",mustika64@example.net,Aktivitas Rumah Tangga Sebagai Pemberi Kerja; Aktivitas Yang Menghasilkan Barang Dan Jasa Oleh Rumah Tangga yang Digunakan untuk Memenuhi Kebutuhan Sendiri,+62-717-506-5348,Besar,700000,Retail,"5579 Jones Row Apt. 171
Richardhaven, WY 72643",2024-01-02,Advance Commercial Credit Analysis as  a Basis for Business Coach: Credit Skill foundation to Become a Business Coach,Sales & Marketing,Online Training,7,63,6,6,3,5.0,no,47.57142857142857
699,PD Widiastuti Firmansyah Tbk,"Tgk. Gaman Prasetya, M.Farm","Jl. Dipatiukur No. 3
Sabang, Jawa Barat 56745",maidahutapea@example.com,Industri Pengelahan,(0624) 136-8849,Menengah,600000,Group,"Unit 8884 Box 5437
DPO AE 08403",2023-12-19,Persiapan Pra Pensiun,Sales & Marketing,Inhouse Training,9,31,9,4,6,6.333333333333333,yes,55.517006802721085
700,UD Lestari (Persero) Tbk,Vanesa Purnawati,"Gang Monginsidi No. 1
Palopo, NT 93697",ira53@example.com,Perdagangan Besar Dan Eceran; Reparasi Dan Perawatan Mobil Dan Sepeda Motor,+62 (887) 095-6415,Menengah,300000,Retail,"73433 Kathleen Oval
Seanland, CO 14827",2023-11-11,Industry Forecasting & Bussiness Valuation Workshop: Start Up & Conventional Business,Office & Administration,Online Training,2,53,10,7,9,8.666666666666666,yes,61.99319727891156
701,PT Napitupulu Gunawan,drg. Hasna Hutagalung,"Gang HOS. Cokroaminoto No. 94
Mojokerto, SB 96630",usmanmarpaung@example.net,Real Estat,+62 (222) 416 9378,Kecil,100000,Retail,"03146 Garcia Course Suite 069
Perkinsberg, IL 89336",2024-01-04,Cash Flow & Credit Management,Office & Administration,Online Training,2,41,1,8,4,4.333333333333333,no,33.476190476190474
702,PT Pradana Halim,Umi Wasita,"Jl. Peta No. 39
Medan, Jawa Tengah 76828",muniwasita@example.org,Industri Pengelahan,+62 (30) 789 8449,Besar,500000,Group,"3918 Richard Springs
Vasquezchester, WI 05825",2023-11-11,Area & Territory Management:,HR & Training,Inhouse Training,6,86,3,5,1,3.0,no,38.0
703,CV Utama,Humaira Permata,"Gang Dipatiukur No. 23
Serang, Sumatera Utara 16445",caraka11@example.org,"Pertanian, Kehutanan, dan Perikanan",+62 (051) 398 2170,Menengah,100000,Group,"PSC 9977, Box 9024
APO AE 15744",2023-11-14,Train The Trainer For Outbound (Indoor-outdoor) Activity,Office & Administration,Public Training,2,25,2,2,5,3.0,no,23.571428571428573
704,UD Maheswara Waskita Tbk,Ida Rahayu,"Jl. Cikapayang No. 685
Banjarmasin, JI 86337",gastipurnawati@example.net,Industri Pengelahan,+62-088-928-3904,Menengah,900000,Group,"71010 Karen Stream
Ramosstad, OK 11884",2023-12-10,Advance RM training: RM sebagai Business Coach kepada Debiturnya. Phase 1:Business Coach Membuat Bisnis Debitur Sukses dan Sustainable,Sales & Marketing,Inhouse Training,1,88,8,7,3,6.0,no,48.285714285714285
705,PT Rajasa Tbk,dr. Jaga Kuswandari,"Jl. W.R. Supratman No. 480
Bima, PB 00435",qjailani@example.com,"Aktivitas Penyewaan dan Sewa Guna Usaha Tanpa Hak Opsi, Ketenagakerjaan, Agen Perjalanan dan Penunjang Usaha Lainnya",(078) 505-6277,Kecil,200000,Retail,"8181 Rodriguez Prairie Apt. 081
Carlstad, WY 12465",2023-12-10,Innovative Business Thinking & Productive Creativity with IDEO & XQ Principles,Leadership & Managerial,Public Training,4,48,4,3,10,5.666666666666667,no,44.952380952380956
706,Perum Kuswandari,Hesti Saragih,"Gang Suniaraja No. 5
Salatiga, BE 06743",sitompulajiman@example.org,Aktivitas Jasa Lainnya,(043) 140 2253,Kecil,300000,Retail,"Unit 2332 Box 9960
DPO AP 77150",2023-11-12,Leaders As A Coach & Sales Team Developer,Credit & Collection,Public Training,2,100,7,2,2,3.6666666666666665,no,38.09523809523809
707,UD Mansur Maryati,"Dr. Syahrini Wastuti, M.M.","Gang Dr. Djunjunan No. 66
Tarakan, DI Yogyakarta 16410",mitra53@example.org,Kontruksi,+62 (0708) 767 7474,Besar,500000,Group,"6775 Andrea Estate
West Michaelmouth, WA 91756",2023-12-24,Managing General Affairs Excellence,Leadership & Managerial,Online Training,5,24,9,1,9,6.333333333333333,yes,48.80272108843537
708,PT Wulandari Jailani,Muni Mardhiyah,"Jalan Jayawijaya No. 715
Salatiga, JB 78441",firmansyahadinata@example.org,Kontruksi,+62-962-507-4488,Besar,200000,Group,"PSC 0050, Box 1198
APO AP 43874",2023-11-20,Teknik Penyelesaian Kredit & Pemasaran AYDA yang Efektif,HR & Training,Inhouse Training,6,22,9,5,3,5.666666666666667,no,44.095238095238095
709,PD Padmasari Mardhiyah,Fathonah Handayani,"Jl. Setiabudhi No. 68
Kota Administrasi Jakarta Timur, Aceh 95913",bgunarto@example.org,Industri Pengelahan,+62-050-467-3245,Besar,400000,Group,"058 George Prairie Apt. 337
East Cody, SC 62581",2023-12-09,Marketing Support & Sales Admin Development Program,Sales & Marketing,Public Training,8,87,1,3,9,4.333333333333333,no,48.61904761904761
710,Perum Wijaya Tbk,dr. Kani Farida,"Jl. Gegerkalong Hilir No. 2
Binjai, DKI Jakarta 54375",estiono82@example.org,"Kesenian, Hiburan Dan Rekreasi",+62 (53) 406-2094,Besar,900000,Retail,"63230 Miller Mountain
East Austinmouth, NE 95574",2024-01-01,Managing People & Talent In Generation Y & Z,Finance,Inhouse Training,5,69,8,7,1,5.333333333333333,no,47.476190476190474
711,Perum Kusmawati,Tgk. Elma Padmasari,"Gg. Erlangga No. 920
Sungai Penuh, Kalimantan Tengah 90748",asamosir@example.net,Pertambangan dan Penggalian,(039) 458 0145,Besar,600000,Group,"0021 Phillip Parks Suite 157
Masonshire, NJ 04802",2023-12-14,Facilitative & Emphatic Leadership,Credit & Collection,Online Training,2,100,6,8,4,6.0,no,51.42857142857143
712,PD Hariyah Situmorang,Tantri Pradipta,"Jl. Cempaka No. 6
Tidore Kepulauan, SU 16142",marpaungega@example.com,Kontruksi,+62 (086) 177 0007,Besar,700000,Group,"577 Booker Overpass Apt. 764
South Michaelchester, AR 23764",2023-11-12,Collection Target Fixing & Motivation Charge Up,Sales & Marketing,Public Training,2,73,5,3,9,5.666666666666667,no,45.666666666666664
713,PD Thamrin Lailasari (Persero) Tbk,Dinda Habibi,"Gang BKR No. 668
Prabumulih, KR 16479",cornelia13@example.org,Informasi Dan KomunikasiAktivitas Keuangan dan Asuransi,+62 (892) 156 5842,Kecil,900000,Group,"24724 Kimberly Plaza
Rosestad, FM 73806",2024-01-04,Cash Flow & Credit Management,Credit & Collection,Public Training,7,92,6,1,7,4.666666666666667,no,49.80952380952381
714,UD Pradana Purnawati Tbk,Lanjar Natsir,"Gg. Medokan Ayu No. 99
Meulaboh, Kalimantan Timur 10521",pprasetya@example.org,Aktivitas Jasa Lainnya,(013) 904-2261,Kecil,300000,Retail,"122 Jessica Terrace Apt. 316
Andersonborough, UT 21625",2023-11-08,Akuntansi dan Keuangan Perbankan bagi Executive Bank,Credit & Collection,Online Training,6,87,1,7,2,3.3333333333333335,no,40.04761904761905
715,UD Siregar Marpaung (Persero) Tbk,"drg. Shania Nababan, S.Ked","Gang Suniaraja No. 608
Samarinda, Sumatera Selatan 32137",milamustofa@example.org,Aktivitas Rumah Tangga Sebagai Pemberi Kerja; Aktivitas Yang Menghasilkan Barang Dan Jasa Oleh Rumah Tangga yang Digunakan untuk Memenuhi Kebutuhan Sendiri,087 691 2794,Menengah,600000,Retail,"211 Richard Union Apt. 306
Noahborough, KS 22618",2023-12-19,Facilitative & Empathic Leadership,Leadership & Managerial,Online Training,6,31,10,5,10,8.333333333333334,yes,62.65986394557824
716,UD Firmansyah Wahyudin (Persero) Tbk,Cornelia Kuswandari,"Gang Sukajadi No. 445
Pekalongan, Kepulauan Riau 35745",prasetyoqori@example.com,Aktivitas Rumah Tangga Sebagai Pemberi Kerja; Aktivitas Yang Menghasilkan Barang Dan Jasa Oleh Rumah Tangga yang Digunakan untuk Memenuhi Kebutuhan Sendiri,+62 (572) 734-5699,Besar,500000,Group,"Unit 5036 Box 3391
DPO AA 69789",2023-12-07,Developing & Writing Corporate Credit Proposal,HR & Training,Inhouse Training,5,36,6,5,7,6.0,yes,48.61224489795918
717,PD Haryanti,Gasti Rajata,"Gang Indragiri No. 446
Bau-Bau, DI Yogyakarta 25878",patricialatupono@example.com,Industri Pengelahan,+62 (0344) 925 9395,Menengah,600000,Retail,"88913 Ruiz Points Suite 960
Lake Michael, DC 21971",2024-01-03,Insight Fundamental Of Investor Relationship; Industry- Vendor-supplier,Leadership & Managerial,Online Training,6,72,3,2,2,2.3333333333333335,no,32.19047619047619
718,UD Hastuti Tbk,Humaira Wastuti,"Jl. Joyoboyo No. 5
Banda Aceh, Jawa Tengah 00009",vuwais@example.org,Industri Pengelahan,+62-0058-533-2238,Kecil,400000,Retail,"7339 Thomas Stravenue Suite 869
Amyfort, KY 33414",2024-01-04,Finance For Non Finance Executive,Office & Administration,Public Training,4,47,4,3,1,2.6666666666666665,no,27.666666666666664
719,PT Marpaung Tbk,"Puti Halima Mandasari, S.E.","Jl. Merdeka No. 4
Meulaboh, Bali 72249",vnajmudin@example.org,"Pengadaan Listrik, Gas, Uap/Air Panas Dan Udara Dingin",(041) 494 4807,Menengah,300000,Group,"9594 Cline Common
West Anthonychester, GU 67511",2024-01-01,Life Coach: Achieving Work-Life Balance,Credit & Collection,Public Training,4,32,1,4,4,3.0,no,27.428571428571427
720,Perum Damanik,Radit Permata,"Gang R.E Martadinata No. 300
Tangerang Selatan, Jambi 44495",umayapurwanti@example.com,Perdagangan Besar Dan Eceran; Reparasi Dan Perawatan Mobil Dan Sepeda Motor,+62 (415) 180-3389,Besar,300000,Retail,"98561 Amanda Square Apt. 246
Hansenstad, VA 93812",2023-11-20,Marketing Support & Sales Admin ,Credit & Collection,Public Training,7,59,3,2,9,4.666666666666667,no,45.095238095238095
721,PD Safitri (Persero) Tbk,Faizah Pradipta,"Gg. Cihampelas No. 91
Bukittinggi, Nusa Tenggara Timur 90575",nwasita@example.net,Perdagangan Besar Dan Eceran; Reparasi Dan Perawatan Mobil Dan Sepeda Motor,+62 (07) 025-0884,Besar,700000,Group,"968 Curry Loaf
Lake Brady, UT 60726",2023-12-18,Drill for Trainers: Mastering 10 Core Trainer’s Tools,Office & Administration,Inhouse Training,2,100,5,9,7,7.0,yes,59.183673469387756
722,PD Latupono (Persero) Tbk,Jane Mayasari,"Jl. S. Parman No. 92
Bukittinggi, KU 87578",hhutapea@example.org,"Treatment Air, Treatment Air Limbah, Treatment dan Pemulihan Material Sampah, dan Aktivitas Remediasi",+62-964-071-0555,Kecil,1000000,Retail,"310 Mary Spring Apt. 802
Cardenashaven, MD 47691",2023-12-21,Hak dan Kewajiban Pegawai di Era New Normal: Adaptasi Kebijakan Baru pasca Covid 19,Sales & Marketing,Online Training,1,91,4,9,1,4.666666666666667,no,41.09523809523809
723,Perum Damanik Utami,"Hardi Pertiwi, S.E.I","Gg. Jamika No. 529
Pematangsiantar, Bali 88903",wwinarsih@example.net,"Kesenian, Hiburan Dan Rekreasi",+62 (0149) 817 7326,Besar,600000,Retail,"49486 Timothy Centers
South Kelly, AS 03416",2024-01-03,Compensation & Benefit Analysis,Office & Administration,Inhouse Training,9,52,2,6,4,4.0,no,43.142857142857146
724,UD Natsir (Persero) Tbk,Cahyadi Pangestu,"Jl. Soekarno Hatta No. 877
Sawahlunto, Sumatera Barat 98538",salahudinnabila@example.com,"Pertanian, Kehutanan, dan Perikanan",+62 (532) 995 6742,Kecil,600000,Group,"4211 Howard Causeway
East Mariotown, DE 35525",2024-01-05,Distribution Management,Leadership & Managerial,Public Training,5,64,4,1,5,3.3333333333333335,no,35.333333333333336
725,UD Marpaung,Gasti Maryati,"Jalan Rajiman No. 46
Bekasi, JB 60981",dpalastri@example.org,"Pertanian, Kehutanan, dan Perikanan",085 387 6529,Kecil,800000,Group,"104 Jamie Corners Suite 872
West Jasonville, IN 92135",2023-12-20,Modern Project Management: Combining Scrum & Sprint,Leadership & Managerial,Public Training,1,44,7,7,7,7.0,no,47.714285714285715
726,PT Nashiruddin Usamah (Persero) Tbk,Damu Latupono,"Gg. Pacuan Kuda No. 8
Denpasar, YO 79870",vanesawaluyo@example.org,Industri Pengelahan,+62-0445-874-1359,Besar,1000000,Group,"14644 Johnson Spring Suite 376
North Charlesshire, TX 71140",2023-11-19,Cash Flow & Credit Management,Office & Administration,Inhouse Training,9,57,5,9,10,8.0,yes,68.75510204081633
727,Perum Winarno Tbk,"T. Caturangga Rahimah, S.IP","Jl. Dipatiukur No. 1
Lhokseumawe, Riau 78574",xmarpaung@example.org,"Administrasi Pemerintahan, Pertahanan Dan Jaminan Sosial Wajib",+62 (441) 176-8876,Kecil,800000,Retail,"89808 Kyle Mill Suite 767
Danielmouth, WI 16313",2023-11-24,"Appreciative Inquiry Application in Resolving Conflict, Executive Coaching, Change Management and Business Transformation",Leadership & Managerial,Inhouse Training,8,43,4,8,10,7.333333333333333,no,59.476190476190474
728,CV Sinaga Napitupulu Tbk,drg. Karman Wibisono,"Gang Raya Ujungberung No. 70
Bengkulu, KB 17832",patricia87@example.org,"Administrasi Pemerintahan, Pertahanan Dan Jaminan Sosial Wajib",+62 (068) 143-4984,Kecil,100000,Group,"734 Hernandez Vista Apt. 433
Thorntonstad, NV 45952",2023-12-01,Creative & Agile Tools of Management Problem Solving & Decision Making in Digital Era,Credit & Collection,Public Training,5,95,2,7,9,6.0,yes,57.04081632653061
729,CV Anggraini,Marsudi Hutapea,"Jl. Rajawali Timur No. 2
Blitar, SS 75653",widiastuticengkal@example.net,Pengangkutan dan Pergudangan,+62 (063) 115 0191,Menengah,200000,Group,"888 Matthew View
Melissaburgh, UT 96298",2023-12-24,Industry Forecasting & Bussiness Valuation Workshop: Start Up & Conventional Business,Office & Administration,Inhouse Training,5,94,7,9,2,6.0,yes,56.89795918367347
730,CV Hasanah (Persero) Tbk,Putri Sitompul,"Gg. Sukabumi No. 817
Tangerang, Sumatera Selatan 65480",jailsaptono@example.org,"Kesenian, Hiburan Dan Rekreasi",(0673) 264-3328,Kecil,700000,Retail,"65139 Robinson Circle
North Jennyside, WA 15665",2023-12-16,Professional Debt Collection Skills,HR & Training,Public Training,7,26,3,2,10,5.0,no,42.285714285714285
731,Perum Padmasari Wastuti,Lalita Latupono,"Gang Rawamangun No. 018
Kota Administrasi Jakarta Timur, BA 91982",gilda55@example.net,Aktivitas Jasa Lainnya,+62-35-762-1468,Kecil,1000000,Group,"6693 Summers Road
Roberttown, WY 18715",2023-12-19,Antisipasi & Pencegahan Transaksi Pencucian Uang,Sales & Marketing,Inhouse Training,6,54,10,3,2,5.0,no,44.857142857142854
732,Perum Usamah,Harjaya Wijaya,"Jalan BKR No. 39
Semarang, JB 89246",samosirjamalia@example.org,"Aktivitas Profesional, Ilmiah Dan Teknis",081 962 1726,Besar,300000,Retail,"Unit 1525 Box 8692
DPO AA 49985",2023-12-16,Finance For Non Finance Executive,Office & Administration,Inhouse Training,1,44,10,5,5,6.666666666666667,yes,47.85034013605442
733,UD Nasyiah Tamba,Caket Wasita,"Gang Cihampelas No. 4
Tasikmalaya, DKI Jakarta 28397",bagasyuliarti@example.net,"Treatment Air, Treatment Air Limbah, Treatment dan Pemulihan Material Sampah, dan Aktivitas Remediasi",+62 (79) 115-3510,Menengah,600000,Retail,"6944 Vargas Ranch Suite 048
North Alanmouth, KY 13138",2023-11-17,"Sekuritisasi Asset: Pengembangan Produk, Analisa Resiko, Aspek Legal, Perpajakan dan Strukturisasinya",HR & Training,Public Training,9,36,7,4,4,5.0,no,46.57142857142857
734,CV Riyanti Prakasa,Emong Haryanti,"Gg. Soekarno Hatta No. 237
Pekalongan, Sumatera Utara 46309",vhakim@example.net,Informasi Dan KomunikasiAktivitas Keuangan dan Asuransi,+62-0380-403-9470,Menengah,500000,Group,"49193 Bradley Vista
Andrewhaven, WY 93671",2023-12-05,Protokoler & Master of Ceremony era Digital & New Normal,Credit & Collection,Inhouse Training,5,33,10,8,9,9.0,yes,65.3265306122449
735,UD Nashiruddin,Luthfi Suwarno,"Jalan Pelajar Pejuang No. 14
Ambon, JA 83077",garang47@example.net,"Pengadaan Listrik, Gas, Uap/Air Panas Dan Udara Dingin",+62 (017) 408-6725,Menengah,1000000,Retail,"544 Lopez Islands
Carrborough, OK 47832",2023-11-22,Analisa Kredit Berbasis Laporan Keuangan,Sales & Marketing,Inhouse Training,4,76,1,6,6,4.333333333333333,no,41.33333333333333
736,PT Jailani Sihotang (Persero) Tbk,"Galih Mulyani, M.Pd","Gg. Cikutra Timur No. 84
Bima, Nusa Tenggara Timur 84961",nwidodo@example.org,Lainnya,+62 (004) 339 6057,Kecil,100000,Retail,"2696 Jones Parkways Apt. 396
Robertfurt, RI 32899",2024-01-05,Tax Amnesty Bagi Karyawan & Profesional,Office & Administration,Online Training,1,79,10,8,4,7.333333333333333,yes,56.65986394557823
737,Perum Hutapea Lestari (Persero) Tbk,Maryadi Saragih,"Jalan Cihampelas No. 066
Madiun, SG 78677",heru66@example.net,Real Estat,+62 (083) 593-3046,Menengah,200000,Group,"577 Sarah Land
Haletown, SC 52095",2023-11-10,Transformasi Budaya & Manajemen Agen Perubahan,Finance,Public Training,6,67,5,1,6,4.0,no,41.0
738,PD Natsir,Olga Suryono,"Gang K.H. Wahid Hasyim No. 0
Samarinda, JI 88150",nurdiyantimurti@example.org,"Aktivitas Profesional, Ilmiah Dan Teknis",+62-088-339-1895,Besar,300000,Group,"24809 Rivera Knolls
Lake Victoriamouth, TX 69273",2023-12-06,Bagaimana Melakukan PHK Dengan Aman Tanpa Gejolak,Office & Administration,Public Training,6,31,8,4,2,4.666666666666667,no,39.666666666666664
739,UD Hutapea Tbk,Sabrina Widodo,"Gg. M.T Haryono No. 135
Bogor, NT 82111",pia32@example.net,Kontruksi,+62 (374) 999 0276,Besar,100000,Retail,"951 Moyer Isle
Mcbridehaven, IL 05753",2023-11-22,Presentation & Selling Skills Using Story-Telling ,Credit & Collection,Online Training,5,98,7,7,6,6.666666666666667,yes,61.27891156462585
740,PD Simbolon,T. Jamal Wibisono,"Jalan Kendalsari No. 0
Sawahlunto, Maluku 69100",nurul75@example.com,Perdagangan Besar Dan Eceran; Reparasi Dan Perawatan Mobil Dan Sepeda Motor,+62 (02) 664-2909,Kecil,400000,Retail,"56088 Weaver Estate
Matthewbury, AL 32300",2023-12-31,Leading & Motivating With NLP,Leadership & Managerial,Online Training,7,87,10,1,2,4.333333333333333,no,47.19047619047619
741,PD Saputra (Persero) Tbk,Karja Pertiwi,"Gg. M.T Haryono No. 04
Sawahlunto, KU 50253",winarsihatma@example.org,"Aktivitas Penyewaan dan Sewa Guna Usaha Tanpa Hak Opsi, Ketenagakerjaan, Agen Perjalanan dan Penunjang Usaha Lainnya",(093) 710 6731,Kecil,200000,Group,"69015 Elliott Ways Apt. 267
East Anthony, PR 55458",2023-12-30,"Manajemen Emosi, Temperamen, Dan Kontrol Diri Untuk Service Excellent",Leadership & Managerial,Online Training,3,38,4,7,1,4.0,no,32.57142857142857
742,PT Wasita Napitupulu,Oni Mulyani,"Jl. M.H Thamrin No. 3
Depok, GO 23810",bagas63@example.com,"Aktivitas Profesional, Ilmiah Dan Teknis",+62 (0000) 636-2976,Kecil,900000,Group,"77229 Kenneth Port Apt. 639
South Geoffrey, MA 73096",2023-12-22,Effective Transactional Banking for Back Office,Finance,Online Training,7,39,7,7,8,7.333333333333333,yes,59.517006802721085
743,PT Laksmiwati,Jayadi Prasetyo,"Gg. Sukabumi No. 90
Pekalongan, MU 21955",jabal64@example.com,Aktivitas Jasa Lainnya,(016) 047 0170,Besar,1000000,Group,"324 Dylan Ports Suite 469
Leahfurt, MD 26789",2023-12-11,Collection Recovery Section Head Development Program,HR & Training,Online Training,7,43,1,10,6,5.666666666666667,no,48.523809523809526
744,PT Oktaviani Mustofa,Drs. Ajiono Thamrin,"Gg. S. Parman No. 055
Jambi, Sulawesi Selatan 38511",samiahjanuar@example.com,Perdagangan Besar Dan Eceran; Reparasi Dan Perawatan Mobil Dan Sepeda Motor,(045) 087-8510,Besar,300000,Retail,"827 Juan Locks
East Kathleenville, MN 12575",2023-12-25,New Requirement for Professional Industrial Relation Officer in New Normal Era,Sales & Marketing,Inhouse Training,6,79,3,6,7,5.333333333333333,no,50.33333333333333
745,Perum Laksita,"Anastasia Padmasari, M.Farm","Gang Rawamangun No. 76
Mataram, Jawa Barat 46858",halima10@example.net,PendidikanAktivitas Kesehatan Manusia Dan Aktivitas Sosial,+62 (713) 322-0459,Menengah,500000,Retail,"030 Miller Land Suite 318
Tammyville, MH 17087",2023-12-19,Teknik Penjualan yang Efektif di Era Covid-19 & WFH,Sales & Marketing,Online Training,1,90,1,2,5,2.6666666666666665,no,29.523809523809526
746,Perum Hartati,"R.A. Zaenab Pertiwi, S.Farm","Jl. Antapani Lama No. 6
Medan, JB 42190",lidya17@example.org,"Aktivitas Penyewaan dan Sewa Guna Usaha Tanpa Hak Opsi, Ketenagakerjaan, Agen Perjalanan dan Penunjang Usaha Lainnya",+62-087-799-5644,Kecil,200000,Group,"36120 Jorge Village
Virginiaborough, SD 59760",2023-12-31,Fintech: Solusi Teknologi Keuangan Bagi Perputaran Ekonomi Skala Kecil Yang Menghasilkan Bisnis Besar,Office & Administration,Online Training,3,80,2,7,1,3.3333333333333335,no,34.761904761904766
747,PT Sihombing (Persero) Tbk,Darmanto Anggraini,"Gg. Kutisari Selatan No. 571
Tomohon, Lampung 24208",taufikyuliarti@example.com,Aktivitas Rumah Tangga Sebagai Pemberi Kerja; Aktivitas Yang Menghasilkan Barang Dan Jasa Oleh Rumah Tangga yang Digunakan untuk Memenuhi Kebutuhan Sendiri,+62-596-169-4782,Menengah,700000,Group,"407 Carrillo Spurs
Royville, DC 75898",2023-12-29,Simple Methode of Corporate Tax Calculation PPN-PPH,Office & Administration,Inhouse Training,4,99,2,1,2,1.6666666666666667,no,29.380952380952383
748,CV Najmudin (Persero) Tbk,"Gabriella Salahudin, M.Pd","Jalan HOS. Cokroaminoto No. 8
Bima, MA 62834",xanana55@example.com,Industri Pengelahan,+62 (116) 533-8445,Besar,200000,Retail,"98367 Amy Cape
South Janefurt, NV 17683",2023-11-16,"Manajemen Emosi, Temperamen, Dan Kontrol Diri Untuk Leader",Leadership & Managerial,Inhouse Training,9,66,5,9,5,6.333333333333333,yes,60.517006802721085
749,Perum Ramadan (Persero) Tbk,Siska Kusumo,"Gg. Jamika No. 9
Dumai, Nusa Tenggara Barat 29844",zamira42@example.com,Aktivitas Badan Internasional Dan Badan Ekstra Internasional,085 059 9567,Menengah,600000,Retail,"5413 Gonzalez Passage
Lake Richardside, PR 67902",2023-11-26,Sales Forecasting: for Sales Target Results,Credit & Collection,Inhouse Training,5,30,2,4,8,4.666666666666667,no,38.09523809523809
750,UD Saptono Adriansyah Tbk,Endah Permadi,"Jl. Sukabumi No. 382
Solok, Maluku Utara 89339",pratiwigarda@example.net,Informasi Dan KomunikasiAktivitas Keuangan dan Asuransi,+62 (0235) 473 0945,Besar,300000,Group,"1192 Cox Coves
Lake Mistyborough, UT 63318",2023-12-20,Effective Transactional Banking for Back Office,Finance,Inhouse Training,5,45,3,9,4,5.333333333333333,no,44.047619047619044
751,PT Winarno (Persero) Tbk,Galang Sinaga,"Gang Kendalsari No. 9
Ternate, Jambi 91473",rprasasta@example.net,Aktivitas Rumah Tangga Sebagai Pemberi Kerja; Aktivitas Yang Menghasilkan Barang Dan Jasa Oleh Rumah Tangga yang Digunakan untuk Memenuhi Kebutuhan Sendiri,+62-041-287-0696,Menengah,300000,Retail,"76146 Amber Drive
Greenmouth, IL 73943",2023-12-04,"Mengelola Team Collection Era Covid-19 bagi Manager,Supervisor & Team Leader: Collector Skills Transformation & Team Motivation Charge Up",Sales & Marketing,Public Training,5,40,3,3,9,5.0,no,41.42857142857143
752,PT Wastuti Santoso (Persero) Tbk,Olivia Pradana,"Jalan Dr. Djunjunan No. 7
Denpasar, SG 29271",mulya66@example.net,"Aktivitas Profesional, Ilmiah Dan Teknis",(047) 683-5437,Kecil,300000,Group,"96083 Adam Way
Lake Dustin, DC 79878",2023-12-10,Effective Communication & Interpersonal Skills,Credit & Collection,Public Training,6,98,5,9,5,6.333333333333333,no,58.76190476190476
753,PD Uwais (Persero) Tbk,"Drs. Hartaka Pradipta, S.T.","Jalan Kebonjati No. 58
Purwokerto, SR 72901",hmahendra@example.net,Aktivitas Badan Internasional Dan Badan Ekstra Internasional,+62 (77) 519-4981,Kecil,1000000,Retail,"2984 Porter Roads
Michaelfort, TN 96910",2023-11-14,Anticipating & Preventing Technique Of Money Laundering,Finance,Online Training,1,99,7,9,8,8.0,no,61.285714285714285
754,CV Rajata,Wardaya Najmudin,"Gg. Abdul Muis No. 5
Pekalongan, Lampung 54175",laswi97@example.org,"Treatment Air, Treatment Air Limbah, Treatment dan Pemulihan Material Sampah, dan Aktivitas Remediasi",+62 (075) 366 2822,Menengah,900000,Retail,"47913 Cristian Landing
North Janet, KS 57581",2023-12-19,Fintech: Solusi Teknologi Keuangan Bagi Perputaran Ekonomi Skala Kecil Yang Menghasilkan Bisnis Besar,Office & Administration,Public Training,1,75,7,4,3,4.666666666666667,no,38.8095238095238
755,CV Ardianto Tbk,R. Nasim Astuti,"Gg. M.H Thamrin No. 41
Balikpapan, Kepulauan Bangka Belitung 58470",widya66@example.com,Aktivitas Rumah Tangga Sebagai Pemberi Kerja; Aktivitas Yang Menghasilkan Barang Dan Jasa Oleh Rumah Tangga yang Digunakan untuk Memenuhi Kebutuhan Sendiri,+62 (434) 268-7855,Kecil,100000,Retail,"877 Bentley Key
Laurenhaven, WV 28735",2023-12-13,Aspek Legal Pembiayaan & Penagihan Kartu Kredit,Sales & Marketing,Online Training,2,92,10,8,10,9.333333333333334,yes,71.37414965986395
756,PD Najmudin Pranowo Tbk,Paris Wacana,"Gang Ronggowarsito No. 064
Tegal, DKI Jakarta 08184",rahman18@example.org,"Aktivitas Profesional, Ilmiah Dan Teknis",+62 (0120) 474-2642,Kecil,300000,Group,"1003 Dillon Glen
Kennedymouth, ME 83600",2023-12-11,Compherensive Train The Trainers,Office & Administration,Public Training,6,79,1,3,1,1.6666666666666667,no,29.380952380952383
